empty,field_opp_no,field_opp_primary_at,field_opp_primary_vt,field_opp_source,field_opp_ideation_date,field_opp_context_field,field_opp_theme,field_opp_description,field_opp_tcv_range,field_opp_tcv_est,field_opp_stakeholder,field_opp_decision_maker,field_opp_potential_competitor,field_opp_comments
,1188,Medtronics,Pharma and Life sciences,Wipro (from Puru),8/1/2017,Horizontal play,Diagnostic labs,"Medtronics looking for engineering service providers who can help them set up ‘Cath Labs’
within CVG
– Provide engineering expertise in terms of equipments to be used, processes
Explore setting up examination/diagnostic labs for other verticals of Medtronics, e.g.
Restorative therapies group",,,,,,
,1189,Medtronics,Pharma and Life sciences,Wipro (from Puru),8/1/2017,Horizontal play,PLM Commonisation,Commonisation of softwares used in Covidien and other verticals of Medtronics,,,,,,
,1190,Medtronics,Pharma and Life sciences,Wipro (from Puru),8/1/2017,Horizontal play,Tooling,Explore designing tools for manufacturing lines across different plants in Medtronics,,,,,,
,1191,Medtronics,Pharma and Life sciences,Wipro (from Puru),8/1/2017,Geographic play,Emerging markets,"Medtronics looking to shift operations from expensive R&D sites such as Ohio to more
affordable sites, e.g. India, China
– Moreover, looking to move end market focus from US to emerging markets, e.g. China,
India, Brazil
– Big focus area for Omar (chief executive officer) going forward
take up end to end outsourcing of products/new medical devices being produced for the
emerging markets
– Engineer end to end design and development of the products
conduct regulatory audits, e.g. FDA regulations are highly stringent in China, hence, huge
opportunity to build stringent engineering compliance mechanisms for Medtronics",,,,,,
,1192,Medtronics,Pharma and Life sciences,Wipro (from Puru),8/1/2017,MITG,Process Streamlining,"Explore providing engineering support within MITG for process validation
– Documentation support
– Build remediation solutions
– File restoration",,,,,,
,1193,Medtronics,Pharma and Life sciences,Wipro (from Puru),8/1/2017,Diabetes group,Line validation,"Often products are required to be moved from one manufacturing line to another due to several
reasons, e.g. changing management, changing demand, hence, constant need for
manufacturing line revalidation
– Work done in the nature of changing machine parts, move the equipments",,,,,,
,1194,Medtronics,Pharma and Life sciences,Wipro (from Puru),8/1/2017,Diabetes group,Packaging and Labelling,"High demand for an outside vendor to take up packaging and labelling of medical devices
such as the automation equipments, infusion sets
– Automated sterilization of medical devices is another area of outsourcing for Medtronics",,,,,,
,1195,Medtronics,Pharma and Life sciences,Wipro (from Puru),8/1/2017,Diabetes group,Product design,"Diabetes group constantly innovates and due to lack of internal expertise, R&D/design of the product concept is outsourced to vendors
High demand for developing new products, e.g. New infusion sets, Low cost pumps etc.",,,,,,
,1196,Medtronics,Pharma and Life sciences,Wipro (from Puru),8/1/2017,Diabetes group,Embedded software engineering,"Explore software design and development in Diabetes group as constant demand within the
group to upgrade algorithms to ensure higher efficiency of medical devices, e.g. insulin
pumps, insulin transmitters
Continue focus on software development and testing within MITG (Covidien)",,,,,,
,1197,Medtronics,Pharma and Life sciences,Wipro (from Puru),8/1/2017,Diabetes group,Processes Validation,"End-to-end engineering support including operations qualification, performance
qualification (key turnkey opportunity)
Support required to write/generate test protocols, execute the protocols and writing
reports
Team of 10 engineers required including a team of manufacturing engineers, design and
quality engineers",,,,,,
,1198,Medtronics,Pharma and Life sciences,Wipro (from Puru),8/1/2017,Diabetes group,IoT/New technologies,"Currently, Medtronics looking for partner organization to automate information collection,
e.g. build devices/ solutions that help them monitor people’s eating habits, blood group,
insulin level in bodies etc.
– Develop solutions, e.g. glucose transmitters with Bluetooth connectivity with body
Remote patient monitoring: Diabetes group typically outsources build and testing of the
remote monitoring solutions",,,,,,
,1199,Medtronics,Pharma and Life sciences,Wipro (from Puru),8/1/2017,Diabetes group,Lean Six Sigma,"Target providing ‘Lean Six Sigma’ engineering support to the Diabetes group at Medtronics
– Increasingly being outsourced by Medtronics to cut costs",,,,,,
,1200,Medtronics,Pharma and Life sciences,Wipro (from Puru),8/1/2017,Diabetes group,Cleaning validation,"Explore ‘cleaning validation’ opportunities within Medtronics
Lack of expertise within Medtronics to develop proper methods/processes to ensure
residual of drugs/other pharmaceutical products is removed from equipments/plants used",,,,,,
,1201,Medtronics,Pharma and Life sciences,Wipro (from Puru),8/1/2017,Cardiac Vascular group,Product design and development,"Target design and development of low-end devices such as PC boards, capacitors
within the cardiac rhythm group
– Design of surgical solutions can also be targeted within CVG
Explore contractual projects for manufacturing of certain components of high end
devices such as pacemakers
– Design of pacemakers usually retained in-house owing to high criticality of devices",,,,,,
,1202,Medtronics,Pharma and Life sciences,Wipro (from Puru),8/1/2017,Cardiac Vascular group,Testing Labs,"Explore setting up ‘medical testing labs’ for Medtronics
– High demand within CVG as patient risk is huge
Provide engineering solutions such as Disinfectant testing, sterilization of devices,
packaging validations extremely critical for MedTech companies",,,,,,
,1203,Medtronics,Pharma and Life sciences,Wipro (from Puru),8/1/2017,Cardiac Vascular group,New Technologies,"Target building new age technology solutions for Medtronics CVG in various areas
– Welding of Pacemakers- ensuring proper welding of components of pacemakers so
that there is no infiltration of blood
– Medtronics on the look-out for a partner who can help them build efficient
equipments/methods to ensure effective welding of pacemakers and other heart
devices
Laser Welding of plastic medical devices",,,,,,
,1204,Medtronics,Pharma and Life sciences,Wipro (from Puru),8/1/2017,Cardiac Vascular group,Drug Coating,"Explore designing ‘repeatable, more efficient’ solutions for medical device coating
(metallic stands etc. are often coated with different drugs)
– Building different deposition methods to ensure accurate drug dosage on the medical
devices, thereby ensuring little scrap",,,,,,
,1205,Medtronics,Pharma and Life sciences,Wipro (from Puru),8/1/2017,Cardiac Vascular group,Cleaning validation,"Explore ‘cleaning validation’ opportunities within Medtronics
Lack of expertise within Medtronics to develop proper methods/processes to ensure residual of
drugs/other pharmaceutical products is removed from equipments/plants used",,,,,,
,1206,ANZ Bank,Banking,Infosys,8/14/2018,,"Employee experience
","Help design front end  platform in line with omni channel vision for the customer experience to enable sophisticated selling by bankers  e.g. sales tools - lead based analysis to offer bundled products 
",,7,"Carolyn Tatley, Tribe lead, Banker experience; Peter Reynolds, Tech Lead, Banking Services
Peter Dalton, Digital & cust exp.
",,,within 6 months
,1207,ANZ Bank,Banking,Infosys,8/14/2018,,"Scaled agile
","Enabling modern development environment  for continuous delivery services - automated testing, production staging environment
",,7,"Chris Venter, Domain Lead, Tech; 
Lorraine Devitt, Head of Tech – Internet banking
",,,6-8 months
,1208,ANZ Bank,Banking,Infosys,8/14/2018,,"Digital ecosystem for SME's
","Develop a platform based on integration of different API's creating a service ecosystem beyond banking for SME's and home owners
",,14,"Chris Venter, Domain Lead, Tech; Ron Specter- emerging Tech and ventures
",,,6-9 months
,1209,ANZ Bank,Banking,Infosys,8/14/2018,,"Credit transformation
","From pure asset based lending to cashflow backed lending by creating a richer view of customer's cashflow across all their transactions
",,22,"Mark Hand, MD Business and private banking 
",,,12-18 months
,1210,ANZ Bank,Banking,Infosys,8/14/2018,,"Institutional banking
","Testing services for new blockchain technology 
",,4,,,,6-12 months
,1211,ANZ Bank,Banking,Infosys,8/14/2018,,"Innovation in payment: NPP integration
","Integration of NPP with the existing systems and IPR management. Currently only in IB but need for Mobile as well
",,1,"Peter Reynolds, Tech Lead, Banking services; Peter Dalton, cust exp. 
Nijal dobson, Banking services business demand lead
",,,within 3-6 months
,1212,ANZ Bank,Banking,Infosys,8/14/2018,,"Innovation in payments
","Help ANZ design their Technology architecture payments strategy and define their end state 
",,14,"Peter Reynolds - head of tech for ANZ
Nijal dobson, Banking services business demand lead
",,,within 6-12 months
,1213,ANZ Bank,Banking,Infosys,8/14/2018,,"Data Analytics: Single view of customer
","System integration across all touchpoints and build a single data source enabling a single view of customer
",,14,"Emma gray, Chief data officer and Megan Anderson, Tech domain lead
",,,within 3-6 months
,1214,ANZ Bank,Banking,Infosys,8/14/2018,,"Data Analytics: Single view of customer
","Predictive analytics engine development to predict customer future needs and increase sales through cross sell and upsell
",,4,"Emma gray, Chief data officer and Megan Anderson, Tech domain lead
",,,within 6-12 months
,1215,ANZ Bank,Banking,Infosys,8/14/2018,,"Data Analytics: Single view of customer
","Consult ANZ on other use cases of advanced analytics e.g. Reducing fraud on credit, personalization of data, 
",,4,"Emma gray, Chief data officer and Megan Anderson, Tech domain lead
",,,within 6-12 months
,1216,ANZ Bank,Banking,Infosys,8/14/2018,,"Data Analytics: Customer data comerciali-zation
","Customer data ecosystem project - how can ANZ create a data engine to commercialize  customer data to enable access to diff. microservices quickly (outside traditional banking)
",,14,"Emma gray, Chief data officer and Exec Sponsor and Rami Mukhpha (Project lead)
",,,within 6-12 months
,1217,ANZ Bank,Banking,Infosys,8/14/2018,,"NPS feedback system 
","Creating a customer feedback platform to generate actionable insights to improve improving episotic NPS and Interaction level NPS 
",,7,"Danielle Curry, centre of excellence lead NPS
Peter Dalton, cust exp.
",,,within 3-6 months
,1218,ANZ Bank,Banking,Infosys,8/14/2018,,"Additional opportunity
","Customer experience Improvement on internet banking platform 
",, -   ,TBD,,,TBD
,1219,ANZ Bank,Banking,Infosys,8/14/2018,,"Additional opportunity
","Oracle replacement 
",, -   ,TBD,,,TBD
,1220,ANZ Bank,Banking,Infosys,8/14/2018,,"Additional opportunity
",Royal Compliance Function,,10,,,,
,1221,Citigroup,Banking,Infosys,8/14/2018,,Microservices,"Migrating away from their TIBCO middleware to a lower cost, agile cloud platform. This needs architechtecting solutions, container management, need expertise in deploying applications on cloud (private cloud - AWS/Azure type",,65,"Gavin Micheal (consumer CIO), Shadman Zafar (Digital head) (NAM), Himanshu Srivastava (Singapore digital head) (APAC), Shamus Weiland (NAM), Jayne Opperman and Craig Bright",,,3-6 months
,1222,Citigroup,Banking,Infosys,8/14/2018,,Microservices,"Building micro services  on cloud hosting - currently part of middleware, fairly UI/UX on thin client. Citi wants to break it up as TIBCO is costly and they want to make it componentized on the cloud - faster deployment, scale up, changes e.g., Limit management - checking customers daily limits",,25,"Gavin Micheal (consumer CIO), Shadman Zafar (Digital head) (NAM), Himanshu Srivastava (Singapore digital head) (APAC), Shamus Weiland (NAM), Jayne Opperman and Craig Bright",,,3-6 months
,1223,Citigroup,Banking,Infosys,8/14/2018,,Mexico platform modernization,"Mexico platform modernization. Four year complete overhaul - moder-nize infrastructure, branch network and transform digital client expe-rience. Total spend of 1 bn till 2020",,200,"Gavin Michael (Consumer CIO), Tiago Spitzer (CIO, Mexico)
",,,2 weeks
,1224,Citigroup,Banking,Infosys,8/14/2018,,Wealth management,"Mass market advisory total wealth advisory on digital platforms, Anand Selva coming in will bing additional emphasis",,13,"Shaymus Weiland, US CIO; Shadman Zafar, CDO; Judd Linville/Anand Selva, US CEO, Consumer Bank, Felimy Greene, Gonzalo Luchetti",,,6-12 months
,1225,Citigroup,Banking,Infosys,8/14/2018,,Wealth management,"Building next generation network, including digitally enabled wealth management centers",,13,"Shaymus Weiland, US CIO; Shadman Zafar, CDO; Judd Linville/Anand Selva, US CEO, Consumer Bank, Felimy Greene, Gonzalo Luchetti",,,6-12 months
,1226,Citigroup,Banking,Infosys,8/14/2018,,Citi digital bank,"Creating enterprise wide fintech acceleration program/layer - labs of IT companies that could help incubate the fintech to enterprise grade - risk free, cloud scale etc. e.g. CitiMobile was enabled by Wipro where Fintechs came and integrated.",,1,,,,3-6 months
,1227,Citigroup,Banking,Infosys,8/14/2018,,Citi digital bank,Open banking platform - Qantas and Virgin money are running on Citi's platform which can be extended worldwide,,25,,,,3-6 months
,1228,Citigroup,Banking,Infosys,8/14/2018,,Citi Mortgage,Citi announced exit from mortgage servicing and moving to origination only model and resizing of mortgage infrastructure,,,"David Chuback (Business –  CEO) , Shamus, Shadman, Butch Ross ",,,3-6 months
,1229,Citigroup,Banking,Infosys,8/14/2018,,Branded Cards,"Transform digital client experience in Branded cards. 60 journeys mapped for change on servicing side. Chatbot rationalization could be one entry point - single harmonized engine vs 6 - active ai banamex, fb messenger, personlytics, etc handling voice and chat)",,27,"Jud Linville / Anand Selva (Business – CEO), Shadman, Shamus, Butch Ross and Rob Strup",,,6-12 months
,1230,Citigroup,Banking,Infosys,8/14/2018,,Branded Cards,Model testing and validation in Cards division – making it more efficient and effective,,27,"Jud Linville / Anand Selva (Business – CEO), Shadman, Shamus, Butch Ross and Rob Strup",,,6-12 months
,1231,Citigroup,Banking,Infosys,8/14/2018,,Branded Cards,Customer lifecycle management and connecting all parts of the journey in branded cards,,27,"Jud Linville / Anand Selva (Business – CEO), Shadman, Shamus, Butch Ross and Rob Strup",,,6-12 months
,1232,Citigroup,Banking,Infosys,8/14/2018,,Commercial & consumer lending,Analytics in commercial lending to deepen the client relationships and drive solutions,,5,"Soneel Raj, Sachin Rege",,,6-12 months
,1233,Citigroup,Banking,Infosys,8/14/2018,,Commercial & consumer lending,Transform digital client experience in commercial lending,,5,"Soneel Raj, Sachin Rege",,,6-12 months
,1234,Citigroup,Banking,Infosys,8/14/2018,,Commercial & consumer lending,Take Buyer initiated payment systems and Digital identity as a service,,5,"Soneel Raj, Sachin Rege",,,6-12 months
,1235,Citigroup,Banking,Infosys,8/14/2018,,Commercial & consumer lending,Consumer lending – Lending at PoS,,5,"Soneel Raj, Sachin Rege",,,6-12 months
,1236,Citigroup,Banking,Infosys,8/14/2018,,Big Data and AI,"Implementation of big data/ AI strategy across regions - integration service, real time analytics and services. Central stack from Enterprise O&T and needs to be built out",,100,"Steven Holzer (Business strategy on enterprise O&T), Mike Simone (Enterprise O&T), Soneel Raj, Yasaman Hadjibashi and Wei Chen",,,6-12 months
,1237,Citigroup,Banking,Infosys,8/14/2018,,Big Data and AI,"Big data - beyond implementation of infra, use cases that deliver value to business",,25,,,,6-12 months
,1238,Citigroup,Banking,Infosys,8/14/2018,,Big Data and AI,"AI - beyond implementation of infra, use cases that deliver value to business",,25,,,,6-12 months
,1239,Citigroup,Banking,Infosys,8/14/2018,,Big Data and AI,Implementation of Big Data reporting and analytics using MS Azure,,25,,,,6-12 months
,1240,Citigroup,Banking,Infosys,8/14/2018,,Cloud and Agile,"Migration to cloud (hybrid cloud), TTS and Consumer. Pilot with Amazon in Mexico for aggregated reporting (initially analysis and reporting to move then transactional work-load), TTS already identified workloads to be moved",,50,Craig Bright / New CTO,,,6-12 months
,1241,Citigroup,Banking,Infosys,8/14/2018,,Cloud and Agile,Implementation of latest Continuous Integration / Continuous Delivery practices and move to true agile ,,50,Craig Bright / New CTO,,,6-12 months
,1242,Citigroup,Banking,Infosys,8/14/2018,,CATE approved implementation,Implementation of Moxstra collaboration app for wealth management based on successful pilot in APAC,,,"Motti Finkelstein
",,,TBD
,1243,Citigroup,Banking,Infosys,8/14/2018,,CATE approved implementation,Implementation of salesforce,,,,,,TBD
,1244,Citigroup,Banking,Infosys,8/14/2018,,CATE approved implementation,Implementation of Pivotal cloud foundry as standard cloud app platform,,20,,,,TBD
,1245,Citigroup,Banking,Infosys,8/14/2018,,Others,"Headcount optimization in operations support and operations digitization - AI, bots, chatbots and enable manual operations work",,,TBD,,,TBD
,1246,Citigroup,Banking,Infosys,8/14/2018,,Others,"Marketing efficiency through campaign optimization, salesforce effectiveness",,,TBD,,,TBD
,1247,Citigroup,Banking,Infosys,8/14/2018,,Others,Entry through Costco relationship for Citi Mortgage pitch,,,TBD,,,TBD
,1248,P&G,CPG,Infosys,8/16/2018,,IT,Conduct DevOps pilots (lead for app support),,,,,,
,1249,P&G,CPG,Infosys,8/16/2018,,IT,Integrating multiple systems to new PLM platform,,,,,,
,1250,P&G,CPG,Infosys,8/16/2018,,IT,Enhancing the work on meshing external data to various data platforms and using Data stewards and governance to demonstrate innovation done in MDM,,,,,,
,1251,P&G,CPG,Infosys,8/16/2018,,Sales,Outsourcing sales back office - eliminate & redesign the sales support activities to create bandwidth for SMO org. Augment AI led automation,,,,,,
,1252,P&G,CPG,Infosys,8/16/2018,,Sales,Drive consumer analytics using CRM / eCommerce data and develop consumer journey ideas,,,,,,12+ months
,1253,P&G,CPG,Infosys,8/16/2018,,Sales,Digital marketing and media operations,,,Chris Wasco / Ezra,,,TBC
,1254,P&G,CPG,Infosys,8/16/2018,,Sales,Digital experience – web/social/Voice/Chatbots,,10,"Andy Zilch / Oral Care - Jason Duff (Mktg Dir), Gabriel GarciaRomero - IT Lead",,,TBC
,1255,P&G,CPG,Infosys,8/16/2018,,Sales,Front end IoT opportunities similar to power toothbrush OralB,,,,,,TBC
,1256,P&G,CPG,Infosys,8/16/2018,,Sales,Expand the existing P&G GDI solution developed for UK/IE to integrate and support Print@HomeCoupons and Samples on other Growing Families websites.,,4,Kent Oldham,,,TBC
,1257,P&G,CPG,Infosys,8/16/2018,,Sales,"DTC - (to validate GCR)
Increasing the efforts for direct to customer - Amazon, Unilever and multiple other firms are harnessing the benefits of direct to customer selling. How can we help P&G go D2C without antagonizing their retail partners as well as overcoming the logistical challenges of shipping eaches to consumers.",,20,"Andy Zilch / Oral Care - Jason Duff (Mktg Dir), Gabriel GarciaRomero - IT Lead",,,TBC
,1258,P&G,CPG,Infosys,8/16/2018,,Supply,"Implement analytics to improve supply (transparency, predictive maintenance, sentiment analysis for product development)",,,,,,
,1259,P&G,CPG,Infosys,8/16/2018,,Supply,"Non SAP app rationalization - Implement IOT, AR/VR, Digital Thread and analytics for manufacturing automation (i.e. IoT opportunities, manpower planning, production planning and procurement). ",,8,"Matthias Triln, Beth C, Mark Hausfeld",,,3 to 6 months
,1260,P&G,CPG,Infosys,8/16/2018,,Supply,"Rationalize tools for R&D (e.g., single PLM) - digital transformation in R&D is underway and Infosys can look to consolidate multiple tools used",,,,,,
,1261,P&G,CPG,Infosys,8/16/2018,,Supply,"Logistics Integrated Services / SSC led integrated models - Help P&G setup an Integrated Logistics Control Center with - Analytical Activities (Tier 2) like Logistics Planning; Warehouse Execution; Logistics OM; Import /Export Planning; Taxes, etc. supported by Business. Transactional Activities (Tier 3) like Logistics Reporting and Analytics; Logistics Operation – Helpdesk ,Real Time Event Tracking etc. can be brought under GBS managed by Infosys
Benefits for P&G could be: Improved CCFOT, Improved Vehicle Fill Rate, Reduced Freight / KM, Reduced Carbon Footprint, Reduced wastages etc.",,15,,,,
,1262,P&G,CPG,Infosys,8/16/2018,,Supply,Strategic Sourcing (picked up from pipeline),,,,,,
,1263,P&G,CPG,Infosys,8/16/2018,,Supply,"Increasing the efforts for direct to customer - Amazon, Unilever and multiple other firms are harnessing the benefits of direct to customer selling; Direct to consumer in Europe and own the end to end purchase path while at the same time leverage retail partners for the fulfillment process.",,,,,,
,1264,P&G,CPG,Infosys,8/16/2018,,Supply,"Connect dots on data sources - order management, distributor data and POS data for demand sensing solutions",,,,,,
,1265,P&G,CPG,Infosys,8/16/2018,,Supply,Zero touch order processing system,,,,,,
,1266,P&G,CPG,Infosys,8/16/2018,,Supply,Tying up brand loyalty in the shopping behavior and how to target the millennials,,,,,,
,1267,P&G,CPG,Infosys,8/16/2018,,Supply,Using APIs - patented area,,,,,,
,1269,P&G,CPG,Infosys,8/16/2018,,Shared services & BPM,Support implementation of MDM capabilities e.g. Product from factory. Product data is very messy within P&G. Retail data not flow through harmonized product categories,,,,,,
,1270,P&G,CPG,Infosys,8/16/2018,,Shared services & BPM,Global contact centre - consulting and redesign with self service and Infosys can enhance experience,,1,Vasanthi,,,OND
,1271,P&G,CPG,Infosys,8/16/2018,,Shared services & BPM,"( HRSS, Sourcing, Order Management , Contract Manufacturing , F&A)",,,,,,
,1272,P&G,CPG,Infosys,8/16/2018,,Shared services & BPM,"Finance platform transformation for month end close - RPA, Predictive systems and advanced reconciliations",,,,,,
,1273,P&G,CPG,Infosys,8/16/2018,,Shared services & BPM,Transformation outside GBS functions in Finance for financial analysis and internal audit,,,,,,
,1274,P&G,CPG,Infosys,8/16/2018,,Shared services & BPM,New model on crack team for proactive pitch in finance transformation,,5,Laura Becker,,,OND
,1275,P&G,CPG,Infosys,8/16/2018,,Shared services & BPM,Joint GTM with likes of McKinsey on financial automation assessment,,,,,,
,1276,P&G,CPG,Infosys,8/16/2018,,Shared services & BPM,AI / Automation in payroll,,,,,,
,1277,P&G,CPG,Infosys,8/16/2018,,Shared services & BPM,Regional strategy for Poland etc,,,,,,
,1278,P&G,CPG,Infosys,8/16/2018,,Shared services & BPM,Architecture assessment and streamlining given multiple systems,,,,,,
,1279,P&G,CPG,Infosys,8/16/2018,,Shared services & BPM,DevOps CoE implementation,,,,,,
,1280,P&G,CPG,Infosys,8/16/2018,,Supply,Building updated transportation model,,,,,,
,1281,Aetna,Healthcare,Infosys,8/30/2018,,Digital,Diversification to modern payment systems from legacy systems using  a two-payment processor methodology in a pilot set for low risk employer groups. ,,1, Renne Ghent,,,12-Jun
,1282,Aetna,Healthcare,Infosys,8/30/2018,,Digital,"AI and genomics adding functionalities  to ordering prescription drugs using  that allow for lower competitive pricing  and better quality alternative options- who is it for, design as a journey, drug 360 degree view


",,15,Scott Waller,,,1 year
,1283,Aetna,Healthcare,Infosys,8/30/2018,,Digital,"Provider data and network optimisation with additional block chain functionality. Application discussion with Medicaid business. Measure of success metric is to track provider NPS score
",,7,"Dan Finki, Paul McBryde, Medicaid VP Jay Atkin",,,12 months+
,1284,Aetna,Healthcare,Infosys,8/30/2018,,Digital,Develop unified platforms for Broker and Associate experience which are accessible on the go. HR analytics for Associate experience,,,,,,
,1285,Aetna,Healthcare,Infosys,8/30/2018,,Digital,"Health cloud  - combine Aetna healthcare system  and B2B datasets and provide strategy on data and cloud management, API and business value applications 

",,20,"Meg Mc Carthy, Renee Zaugg, Claus Jensen, Mark, Firdaus",,,2 years+
,1286,Aetna,Healthcare,Infosys,8/30/2018,,Analytics,"Extending analytics to new datasets  from claims data to consumer data, patient appointment scheduling data, patient utilization of non-claim medical service, use warehouse relationships.",,50,"Dan Finke, Ali Keshavarz",,,12+ months
,1287,Aetna,Healthcare,Infosys,8/30/2018,,Analytics,"Population health management (Study and facilitiate care delivery across a general population), to improve cohort based adoption and  conduct state wide PHM. Infosys can partner with the right AI solutions and tie to outcomes,",,,Medicaid Jay Atkin ,,,
,1288,Aetna,Healthcare,Infosys,8/30/2018,,Analytics,"


Prior authorization to improve care management, improve workflows and reduce admin costs through a combination of sales, financial and member interaction data platforms
",,5,Medicaid Jay Atkin ,,,
