empty,field_opp_no,field_opp_primary_at,field_opp_primary_vt,field_opp_source,field_opp_ideation_date,field_opp_context_field,field_opp_theme,field_opp_description,field_opp_tcv_range,field_opp_tcv_est,field_opp_stakeholder,field_opp_decision_maker,field_opp_potential_competitor,field_opp_comments
,796,General Electrics,NA/ Conglomerate,LTI,12/11/2016,Any unit with acquisition,System rationalisation and integration for acquired companies,"Opportunity for ERP and systems integration for GE's acquisitions/merger
Baker Hughes being the latest one
Power comprises of 4 acquisitions
Complexity with field service operations due to acquisitions
Likely to eliminate systems that don’t make sense
Example: Big challenge to get right field engineers on time ",,,….,,,
,797,General Electrics,NA/ Conglomerate,LTI,12/11/2016,"All units, specifically healthcare",Cloud migration,"Huge thrust on cloud migration given cloud-ready data centers (particularly for Healthcare unit - under strong pressure to cut costs to make financials look good to sell-off business)
Transportation: Java-based applications which have to be migrated to cloud
Example: Amazon enabled change management in organization after cloud migration",,,"Jorg Debatin (CTO – Healthcare)
BU CTOs",,,
,798,General Electrics,NA/ Conglomerate,LTI,12/11/2016,"Power
Aviation",Monitoring and predictive analysis for maintenance services,"Provide high-value analytics services on product maintenance that GE can use to monetize from customers, example
Power: For turbines, analysis to minimize down time by understanding right time to schedule a wash in the context of each plant
Aviation: For jet engines, identify kind of maintenance required (trying to pitch to Qatar Airways, Lufthansa, United Airlines)
",,,"Clay Johnson – CIO GE Power
Jude Schramm – CIO GE Aviation",,,
,799,General Electrics,NA/ Conglomerate,LTI,12/11/2016,"All units, but varies in extent; most prominent in Transportation",GE Thread: Product Lifecycle Management,"Using Predix OS, create a seamless flow of data across isolated systems (e.g., ranging from quotes, order receivals, requirements gathering,  requisitions, engineering bill of material, manufacturing bill of material, warranty)
Requires strong Product Lifecycle Management (PLM) expertise",,,"Shane Fitzsimons - Head of Shared Services
Nancy Andersen - CIO GE Transportation",,,
,800,General Electrics,NA/ Conglomerate,LTI,12/11/2016,Transportation,Remote monitoring and diagnostics,"Remote monitoring and diagnostics over 40,000 IoT enabled locomotives
Mode of engagement: Augmenting internal engineering and IT teams",,,…,,,
,801,General Electrics,NA/ Conglomerate,LTI,12/11/2016,All units,"Develop data lakes, create tools and staff data scientists","Create data lakes to gather data from equipments
Develop reporting tools, widgets for data visualization
Identify flags that can potentially shut down equipments
Marry gathered data with external environment conditions
Example: Application of top of compressor analysed thousands of parameters collected, and identified dust during harvest season as cause for shutdown; enabling preventive actions for future
Provide data scientists with domain expertise for taking action based on analysis (highly valued resource)",,,…,,,
,802,General Electrics,NA/ Conglomerate,LTI,12/11/2016,All units,IoT application development,Develop domain specific applications on top of Predix platform,,,"Harel Kodesh; BU CDOs, CIOs",,,
,803,General Electrics,NA/ Conglomerate,LTI,12/11/2016,Transportation,Performance monitoring,"Focus on softwares with a customer-centric approach for solution development 
Train performance monitoring, fuel efficiency solutions potential opportunities
Infosys, Cognizant primary incumbents here",,,,,,
,804,General Electrics,NA/ Conglomerate,LTI,12/11/2016,Transportation,Factory automation,"Agile approach for automating factory operations like supply chain, materials management",,,,,,
,805,LafargeHolcim (Lafarge),Construction,LTI,12/13/2016,,Preventive maintenance,"Optimized planning and execution for preventive maintenance: analytics to avoid plant stoppages, enabling plant managers to act before time",,,,,,
,806,LafargeHolcim (Lafarge),Construction,LTI,12/13/2016,,Efficiency enhancement through IoT,"Enhance efficiency and utilisation of plant through IoT backed solutions (e.g., IBM technologies), example:
Sensing and capturing: Data from sensors captured, cleaned and structured
Analysis and modelling: Advanced analytics tools to analyze the data and to create adaptive, self-learning models 
Decision making and actuation – Optimize key parameters to stabilize and reduce energy consumption
Is an opportunity in NA, Canada because of new cement manufacturers coming in after 20-25 years with latest technologies; will force incumbents like LafargeHolcim also to cut costs",,,,,,
,807,LafargeHolcim (Lafarge),Construction,LTI,12/13/2016,,Quality check and quality assurance,"Adapt quality check and quality assurance for plants by location, given variability in core inputs, additives, waste emission rules across plants
Enable quality control monitoring for plants at central level
Cement business already possess this but not user-friendly; services quality is the key differentiator",,,,,,
,808,LafargeHolcim (Lafarge),Construction,LTI,12/13/2016,,Crew tracking,"Provide real-time status updates on total crew deployed across work fronts, number of active working hours, entry into unauthorized areas",,,,,,
,809,LafargeHolcim (Lafarge),Construction,LTI,12/13/2016,,Carrier optimization,"Performance optimization: 
Comparative analysis of how different carriers (e.g., sea fleet, road fleet) are performing on safety and performance indicators 
Tarriff optimization: 
Benchmarking freight costs and maintaining transparency across routes and providers
Opportunity size: >$5Mn",,,,,,
,810,LafargeHolcim (Lafarge),Construction,LTI,12/13/2016,,Route planning,"Dynamic optimization: Adjustment of routes based on daily changes in volume to avoid underutilization
Planning of trucks and drivers: Transparency on actual time and capacity as basis for allocation of trucks
Tracking of trucks: Expand solution from India to other geographies
Systematic planning of inbound and outbound transport
Service trade-offs: Understand trade-offs between delivery frequency and order sizes",,,,,,
,811,LafargeHolcim (Lafarge),Construction,LTI,12/13/2016,,Customer demand forecasting,"Applications to pre-emptively forecast when customer is going to run out of cement, based on their capacity and inventory levels – helps in optimizing logistics cost",,,,,,
,812,LafargeHolcim (Lafarge),Construction,LTI,12/13/2016,,Supplier optimization,"Analytics to choose best suppliers, ensure performance management ",,,,,,
,813,LafargeHolcim (Lafarge),Construction,LTI,12/13/2016,,Customer service,"Web and mobile based order management system with real time visibility of order status (ordering, funnelling, invoicing)
Develop applications for digitizing and sharing product information with users
Real-time customer service level measurement",,,,,,
,814,LafargeHolcim (Lafarge),Construction,LTI,12/13/2016,,Customer satisfaction analysis,"Incorporate customer satisfaction survey:
Identify loyal customers who promoting Lafarge to other customers
Identify pain points, synthesize customer issues for sharing across organisation, ensure customer concerns are addressed through innovations",,,,,,
,815,LafargeHolcim (Lafarge),Construction,LTI,12/13/2016,,"Online platform for stakeholder integration
","Create a digital ecosystem by integrating all players in the construction value chain on an online platform
Provide enhanced omnichannel buying experience for end users
Leverage “big data,” automation revolution, and building information modeling software",,,,,,
,816,LafargeHolcim (Lafarge),Construction,LTI,12/13/2016,,System disintegration for company divestitures,Unhook divested companies from systems using a standardised methodology ,,,,,,
,817,LafargeHolcim (Lafarge),Construction,LTI,12/13/2016,,Management performance tracking tool,"Comprehensive and cohesive management tool with a common language across group
Ability to performance manage value drivers centrally
Move from EBITDA driven management to value creation framework employing pricing, cost drivers, free cash flow drivers (investment decisions, net working capital management), asset utilization and capital efficiency drivers
Compute average price of products given complexity of price variations across customer segments, geographies",,,,,,
,818,LafargeHolcim (Lafarge),Construction,LTI,12/13/2016,,Migration from JDE to SAP and cross-country integration,"System integration across 90 countries of presence, with ~50 overlapping geographies
Customization of SAP instances by region, country and product lines for frontline employees",,,,,,
,819,LafargeHolcim (Lafarge),Construction,LTI,12/13/2016,,Salesforce implementation,"Push to go worldwide, Salesforce 2nd biggest area of spend after SAP",,,,,,
,820,LafargeHolcim (Lafarge),Construction,LTI,12/13/2016,,Knowledge management,"Develop a group-level knowledge management system across functions (e.g., operations, supply chain, R&D) – no system present currently ",,,,,,
,821,LafargeHolcim (Lafarge),Construction,LTI,12/13/2016,,Business process automation,"Automation of back-office shared services functions (e.g., HR - payroll, finance – accounts payables, accounts receivables)",,,,,,
,822,LafargeHolcim (Lafarge),Construction,LTI,12/13/2016,,Document management systems,"Document management manages authoring, storing, archiving, search, and retrieval of documents
Data processed:
Forms required by regulatory bodies
All documents to be included in official submissions or stored for compliance purposes (e.g., regulatory authorities)
Value proposition:
Lowers costs of regulatory compliance by improving ability to archive and search regulatory forms, transparency and communication",,,,,,
,823,LafargeHolcim (Lafarge),Construction,LTI,12/13/2016,,Safety systems,"Automatic reporting of safety information increases regulatory compliance
Analytics allows early detection of “safety signals” (trends)
Data mining allows AEs to inform product development and demonstrate effectiveness
System description:
Maintains Adverse Events (AEs) information, manages content of safety letters
Ensures distribution of safety documents to investigational sites
Data processed: 
Adverse Event reports
Trends / “Safety Signals”
Safety letters/documents",,,,,,
,824,LafargeHolcim (Lafarge),Construction,LTI,12/13/2016,,Lab asset scheduling,Scheduling applications for optimizing use of lab assets across different projects,,,,,,
,825,Scania,Auto,LTI,12/14/2016,,Virtual identity card for component tracking,"Need to track all components going into assembly – for better inventory tracking and product profiling
Requirement for database management systems to store and track data 
Could be used for optimal tracing of issues in case of product recalls (especially relevant in light of recent Volkswagen recall)",,,,,,
,826,Scania,Auto,LTI,12/14/2016,,Audit for tested assets,"Automotive industry under the pressure of stricter regulations, especially for reduced emissions
In light of Volkswagen’s recent recall, shift to auditing every component and vehicle moving out of testing 
Increased necessity for data tracking, massaging and storage for tested vehicles for audit purposes",,,,,,
,828,Scania,Auto,LTI,12/14/2016,,Data-driven process and quality optimization,"Real time monitoring of production process for advanced quality checks
Scope to minimize labor intensive rework and waste (reducing material cost) by adjusting process parameters based on a monitoring of all quality related variables",,,,,,
,829,Scania,Auto,LTI,12/14/2016,,Production program planning based on demand prediction using consumer data,"Potential to increase revenues by reducing the number bad sellers which have to be discounted
Reduce inventories by optimizing storage times",,,,,,
,830,Scania,Auto,LTI,12/14/2016,,Predictive maintenance for production machines and tools,Predictive maintenance can reduce the frequency of maintenance interventions (compared to conservative preemptive maintenance) while still allowing for forward planning of machine downtime,,,,,,
,831,Scania,Auto,LTI,12/14/2016,,Collaboration platforms ,"Number of entities collaborate on product design – including component manufacturers
Need for a common platform for engineering teams to share data and designs
Cybersecurity for these platforms will be of utmost importance, to ensure that designs are not leaked outside ",,,,,,
,832,Scania,Auto,LTI,12/14/2016,,Digital app for mobility solutions ,"Automotive industry moving from ownership to mobility (pay per use and subscription based services)
Giving rise to increased fleet sharing and rentals – digital platform needed to enable the customers to rent vehicles, pool shipments, and manage accounts
Needs to be backed with a strong backend system aided with analytics to drive allocation, scheduling and dispatching to increase asset utilization ",,,,,,
,833,Scania,Auto,LTI,12/14/2016,,Single sign on customer portal ,"Currently, a typical customers have to engage with multiple web portals and agencies (such as insurance, service scheduling, usage monitoring, etc.) to be able manage their cars
Case to integrate all customer relevant information into a single sign on customer portal help them manage these services seamlessly ",,,,,,
,834,Scania,Auto,LTI,12/14/2016,,Dealer Management System ,"Automotive industry plagued with a handful of dealer management systems (DMS) like Autologica
On an average, any OEM would be interacting with 800 DMS systems – resulting in unnecessarily complicated information management with the dealers (stocking/order bookings/financing options, etc.)
Critical need for a central platform that could provide for a seamless information flow between DMS’s and the OEM ",,,,,,
,835,Scania,Auto,LTI,12/14/2016,,Fleet management systems ,"Typical customers have multiple vehicles in their fleet – asset tracking and monitoring becomes increasingly critical for efficient operations
Would like to be updated with current locations, conditions, downtime to ensure the maximum utility of their fleet
Based on analysis of the data available, the platform could also be used to help customers in scheduling and dispatching of their fleet – thereby minimizing downtime of the vehicle
Analytics could be used further to incentivize drivers based on their asset utilization and usage, thereby increasing the asset life 
",,,,,,
,836,Scania,Auto,LTI,12/14/2016,,Data analytics for customized insurance premiums ,"Vehicle usage monitoring gives better insights for the insurance firms to customize their premiums based on driving behavior patterns, vehicle usage and external/environmental conditions
Scope for using analytics to correlate premiums and payment models (pay how you drive and pay as you drive) to increase revenue and reduce costs
Could be utilized further to offer special short-term pushed insurance based on location/ time of the day such as anti-theft insurance in given areas for one night/week ",,,,,,
,837,Scania,Auto,LTI,12/14/2016,,Real time data analytics for network parking service ,"Case for extending navigational services by providing optimized utilization of available parking space through networked parking 
Especially relevant for commercial vehicles who use parking spaces as opportunity to rest between long haul drives
Would need real time data analytics to identify the right parking spots based on vehicle location, parking requirements and available parking spaces (based on data provided by parking service providers)
Opportunity to extend services in the form of a digital application that can actively guide the driver to the closest-to-destination free parking slot, help in the booking process, assist in the payment and support on ticketing/fining process in case of parking violations”",,,,,,
,838,Scania,Auto,LTI,12/14/2016,,Digital platform for in-vehicle controls,"Current models filled up with multiple controls to manage the internal environment – different controls for temperature, windows, wipers, music, etc.
With the advent of connected cars – automotive industry is gearing up towards using a single portal to manage all these controls
Would need the help of a third party IT service vendor to create a digital portal for seamless control of the entire internal environment ",,,,,,
,839,Scania,Auto,LTI,12/14/2016,,Optimized Route Navigation ,"Case for building dynamic route optimization systems to adjust/reduce travelling time in real time in function of changed conditions on route (e.g., traffic, weather, safety)
Real time data analytics on external data (air/ surface temperature, humidity, other vehicles’ position, etc.) and vehicle usage data (current location, destination of the vehicle, ) to identify optimized routes for drivers
Vehicle-to-vehicle communication could be utilized further for accident avoidance and traffic management",,,,,,
,840,Scania,Auto,LTI,12/14/2016,,Digital infotainment dashboard ,"Automotive industry looking to enhance customer experience through providing customers the possibility to purchase and enjoy infotainment contents (music, videos, video games) and improve their comfort through car-enabled concierge services (washing/refueling/food stops)
Need for digital platform to enable browsing through offered services, and purchasing of the services
Case to deploy analytics based on customer preferences, behavior, historic purchases to make the offerings more tailored to suit the customer needs, thereby increasing the purchase frequency and magnitude ",,,,,,
,841,Scania,Auto,LTI,12/14/2016,,Data analytics for condition based predictive maintenance for vehicle ,"Automotive industry is gearing up towards predictive condition based maintenance rather than service interval target based maintenance
Particularly in line with increasing in-workshop traffic through maintenance recommendations and targeted maintenance campaigns
Need for data analytics on combined parameters related to technical status of the vehicle (oil/liquids temperature, fault alerts, etc.) and vehicle usage(acceleration, motor rpm, etc.) ",,,,,,
,842,Scania,Auto,LTI,12/14/2016,,Scheduling systems for aftersales services ,"Goes hand-in-hand with predictive condition based maintenance – will help aftersales support team to optimize their bandwidth through pre-booking of the slots available
Inventory management based on updated schedules will help in increased efficiency of the services ",,,,,,
,843,Scania,Auto,LTI,12/14/2016,,Digital platform for over-the-air software add-ons ,"One of the ways automotive industry is planning to upsell, is through over the air software upgrades – allowing customers to buy new functionalities and services even after the vehicle has been bought
Need to develop a digital platform for software upgrades based on customer preferences 
Case for utilizing analytics for understanding the best offerings for individual customers – based on their preferences for in car behavior, data usage and requirements ",,,,,,
,844,Scania,Auto,LTI,12/14/2016,,Warranty cost optimization ,"Predictive analytics for stocking for spare parts of vehicles coming for services, based on historical data and service schedules
Aided by real time vehicle usage and performance data coming in from vehicles on ground ",,,,,,
,845,Scania,Auto,LTI,12/14/2016,,Analytics backed inventory management for spare parts ,"Potential to reduce material cost and inventories by generating transparency for suppliers
Facilitate JiT and JiS deliveries in complex production systems (e.g., with high variant diversity)",,,,,,
,846,Scania,Auto,LTI,12/14/2016,,Early recall detection and software updates ,"Analysis of remote on-board diagnostics data in order to identify technical issues early on to ensure OEM’s can promptly intervene on software and hardware updates
This will help on fast identification of the vehicles with malfunctions to track and isolate “manufacturing batches” and prevent more “bad” products entering the market before intervention",,,,,,
,847,Scania,Auto,LTI,12/14/2016,,Vehicle usage monitoring,"With increasing popularity of pay-per-use model, vehicle monitoring based on usage is becoming increasingly popular
Such monitoring is especially critical for insurance markets and second hand vehicles
Need for business intelligence suites to track historic record of the real usage, maintenance and repair history of the car
Case for extending footprint to mobile apps which would allow drivers to monitor their driven kilometers, time, location, and driving style",,,,,,
,848,Scania,Auto,LTI,12/14/2016,,Digital app for efficient information sharing for sales team,"Sales force needs to be equipped with relevant information for making targeted efforts 
Digital information flow needed based on customer profiling to help identify what to sell, where to sell, and helping dealers with optimized financing options for end customers
Need for a digital mobile app with that provides the sales force with cleansed and targeted data to enable them in increasing their sales ",,,,,,
,849,Scania,Auto,LTI,12/14/2016,,Analytics driven customer profiling ,"Automotive sales moving towards intelligent targeting – paves way for analytics backed customer profiling based on personal data, social medical/profile, location, browsing history, etc. 
Cluster analysis of customers, especially based on their usage, fleet size, economic statuses, performance and maintenance needs
Business intelligence to monitor and track existing customers and understand their usage and performance requirements
Creates a base to help automotive firms to upsell and cross-sell their offerings like maintenance and insurance ",,,,,,
,850,Scania,Auto,LTI,12/14/2016,,Optimized distribution network ,"Emergent need to reduce time to delivery after booking the vehicle
Multiple decisions are taken which greatly affects the delivery time – what and here to store, what to sell, channels to sell, etc.
Case for employing data analytics to aid in intelligent decision making on these drivers ",,,,,,
,851,Scania,Auto,LTI,12/14/2016,,Automation for employee onboarding and off-boarding ,"Weak employee portals in place in Volksawagen as well as Scania pave way for third party vendors to intervene
Employee onboarding and off-boarding is mostly manual – need a more integrated system to be implemented to efficiently manage employee as well as contractors ",,,,,,
,852,Philips 66,EPNG,LTI,1/11/2017,,Expert finder ,•Finding the expert in a particular area is difficult (e.g. teams often want to know who the correct individual to ask about a geology/equipment related question is but there is not automated way to look up people's expertise) ,,,,,,
,853,Philips 66,EPNG,LTI,1/11/2017,,Field mobile computing ,"•Hardcore field devices are becoming more practical as hardware capabilities have increased
•Could possibly create an app store (there are a large number of applications such as asset management and maintenance that can be put into applications)
•Putting QAS and security in network is important
•There are multiple interesting use cases e.g. camera to show the expert the problem ",,,,,,
,857,Philips 66,EPNG,LTI,1/11/2017,,Estimating costs for environmental regulations ,•Investments required to meet regulation and it’s hard to actually know what the cost will be to meet the relevant requirements when choosing a location/creating a pipeline ,,,,,,
,858,Philips 66,EPNG,LTI,1/11/2017,,Scheduling for logistics  ,"•A large number of trucks are involved and it is important to optimize time and vehicle miles
•Utilization and cost to ship (power, people, supervision (scada), environmental, repair and maintenance) are important metrics that are tracked ",,,,,,
,860,Philips 66,EPNG,LTI,1/11/2017,,Centralize gas controls and pipeline operations ,•Integrate and centralise gas controls and pipeline operations ,,,,,,
,861,Philips 66,EPNG,LTI,1/11/2017,,Geospatial analytics,•Optimize supply and distribution networks using solutions like location planning and  route optimization ,,,,,,
,862,Philips 66,EPNG,LTI,1/11/2017,,Digital procurement ,"•Application of advanced analytics of big data to automates processes, and use new collaboration models with suppliers and business users ",,,,,,
,863,Philips 66,EPNG,LTI,1/11/2017,,Oil loss tracking ,"•Application of digital tools along the (e.g. truck monitoring, automated gauges for tanks) linked directly to ERP system for centralized reporting ",,,,,,
,864,Philips 66,EPNG,LTI,1/11/2017,,Linking scheduling and inventory with demand ,•Scheduling and inventory are modelled based on the distribution system and supply but these systems are not integrated,,,,,,
,865,Philips 66,EPNG,LTI,1/11/2017,,Linking scheduling and inventory with demand ,"•There are a number of entities involved in the entire process (pipelines, trucking, marketing) and there is an opportunity to integrate data across these and create scheduling algorithms based on demand 
•Optimization is usually done manually (e.g. deliveries are selected by managers based on limited data from the 2-3 terminals available to them) ",,,,,,
