empty,field_opp_no,field_opp_primary_at,field_opp_primary_vt,field_opp_source,field_opp_ideation_date,field_opp_context_field,field_opp_theme,field_opp_description,field_opp_tcv_range,field_opp_tcv_est,field_opp_stakeholder,field_opp_decision_maker,field_opp_potential_competitor,field_opp_comments
,420,Credit Suisse,Banking,ThoughtWorks,3/1/2018,,Reduction of DevOps cost,"Reduce DevOps cost through automation tools for development, testing and migration",,,"Radhika Venkataraman
Niranjan Reddy, APAC and Shared Services",,,
,421,Credit Suisse,Banking,ThoughtWorks,3/1/2018,,AI and Robotics,"AI for Risk Management and AML
Robotics – RPA for process improvement for Global Markets/ Wealth Management
Robo – advisory for Wealth management",,,"Andeas Blatt (reports into Claude)
Suman D'souza (reports to Andreas Blatt)
Jason Shaun",,,
,422,Credit Suisse,Banking,ThoughtWorks,3/1/2018,,Client onboarding process improvement,"Client onboarding and AML check processes are manual and bulky – example, checks manually done and put on Sharepoint system; opportunity to improve process
Due to compliance to new regulations such as MFID2 compliance (Europe focused) - would require modifications to current processes",,,"Jason Shane, CIO, CCRA",,,
,423,Credit Suisse,Banking,ThoughtWorks,3/1/2018,,"Issuance of debt/ equity securities
[in Investment Bank]",Electronifying the issuance of equity and debt securities; building Book building platforms in Investment Bank,,,x,,,
,424,Credit Suisse,Banking,ThoughtWorks,3/1/2018,,Loan products management [in Securities],Issuance/ management of loan product based on new regulations and cost effectiveness,,,"Radhika Venkataraman, CIO, Global Markets",,,
,425,Credit Suisse,Banking,ThoughtWorks,3/1/2018,,Better client management [in Global Markets],"More efficient and effective engagement through CRM tools - given the new technologies and ML/ AI
Opportunity to upgrade current tools/ better visualisation",,,x,,,
,426,Credit Suisse,Banking,ThoughtWorks,3/1/2018,,System upgrade in Risk function ,"Risk (central function) has lot of legacy infrastructure, that would require upgrading",,,"Joe Auckland (Head, Risk)
Guy Kesrsley, Credit, NYC
Tan Miller, Credit, NYC",,,
,427,GAP,Manufacturing,ThoughtWorks,3/1/2018,,Distribution channel integration in supply chain function,"Supply chain: Distribution centers for online and in-store are separate and does not allow flexibility from a demand point of view, would need to have a flexible inventory management system
Stores are independent – can you give stores credit, with a lead time inventory:  essentially, restructure inventory management independent of location",,,"Sally
Sebastian
Brand tech groups",,,
,428,GAP,Manufacturing,ThoughtWorks,3/1/2018,,Enhancing the online shopping experience,Future proofing the ecommerce platform – they are built for now but current version needs more flexibility,,,x,,,
,429,GAP,Manufacturing,ThoughtWorks,3/1/2018,,Location awareness and augmented reality in stores,"Location awareness in a store and augmented reality – example, extending the aisle while on the phone",,,x,,,
,430,GAP,Manufacturing,ThoughtWorks,3/1/2018,,Improvement in GAP online performance,"Online Performance: Not responsive enough, its slow and doesn’t work well
We need better instrumentation to check the micro-elements of the site, to zoom in on the issues that are really important",,,x,,,
,431,GAP,Manufacturing,ThoughtWorks,3/1/2018,,Cross-brand  and cross-channel journey through platform integration,"Understand the journey of customer from mobile to desktop to store – cross-brand journey
GAP platforms need to work together to support that",,,x,,,
,432,GAP,Manufacturing,ThoughtWorks,3/1/2018,,POS process/ systems improvement,"Improvement in POS systems: Old Navy has long queues, how can you reduce these lines; 
Create similar to Amazon store experience maybe – self-checkout processes etc.",,,x,,,
,433,GAP,Manufacturing,ThoughtWorks,3/1/2018,,Automated promotion decisions and margins,"Gap, Banana Republic and Old Navy are big on promotions
For inventory/ selling – create automated algorithms for the right promotions at right margins",,,x,,,
,434,GAP,Manufacturing,ThoughtWorks,3/1/2018,,Mirror online shopping experience at store,"Use technology to decrease the size of the stores
Align arrangement of a store to mirror the online experience",,,x,,,
,435,GAP,Manufacturing,ThoughtWorks,3/1/2018,,End to end product lifecycle management systems,"Each brand has their own PLM systems – but there can be better ways to do the sampling/ tech design/ product management/ digitization of apparel sourcing
GAP is looking for faster/ easier ways to do it",,,"Brand Tech groups
Brand heads of sourcing",,,
,436,GAP,Manufacturing,ThoughtWorks,3/1/2018,,AI/ VR to reduce sample shipping and better website experience,"Use AI/ VR to design product, to reduce shipping samples back and forth
Use AI for selling on a website and virtually try on a product
GAP is actively looking for help here",,,"Sally
Sebastian
Brand tech groups",,,
,437,GAP,Manufacturing,ThoughtWorks,3/1/2018,,Omni channel customer experience,"Seamless transition from online/ mobile app to store experience
Example: Store manager would know on the Ipad if the customer is in the store – to be able to bring the experience offline to in-store",,,"Sally
Sebastian
Brand tech groups",,,
,438,GAP,Manufacturing,ThoughtWorks,3/1/2018,,Improving in-store technology,"Improve in-store technology: Labour scheduling at store level, how employees manage sign in/ sign out etc.",,,"Sally
Sebastian
Brand tech groups",,,
,439,Hudson's Bay,CPG,ThoughtWorks,3/1/2018,,Integration of SKU information across brands,"HBC needs a common database where all SKUs of each brand can be displayed - on both ends of the workflow
Ingestion: Common information management system/ database
Expose stock availability from any brand",,,x,,,
,440,Hudson's Bay,CPG,ThoughtWorks,3/1/2018,,Integration of external SKUs with brand SKUs,"For Products that are not owned by the brands – better management to ensure product information tie together between different vendor IDs 
HBC is losing out on incremental sales in absence of it ",,,Dion Rooney,,,
,441,Hudson's Bay,CPG,ThoughtWorks,3/1/2018,,Extension of Walmart marketplace to other brands,"Lord & Taylor is currently setting up shop within Walmart – extension of the current work, especially to HBC banner
Creating systems that help in payment/ managing orders; HBC was looking at Miracle product earlier",,,RJ Cilley,,,
,442,Hudson's Bay,CPG,ThoughtWorks,3/1/2018,,More nimble and robust common platform,"Common platform – build an enterprise modular platform to that is nimble and robust; check are all the brands using the same functionality?
Come up with plan with areas that are not common yet",,,x,,,
,443,Hudson's Bay,CPG,ThoughtWorks,3/1/2018,,Changing the store experience,"Enabling store associates to communicate with customers when they are out of store; 
Ensure better store experience technology – Example, Touchscreen in dressing room/ outfit modelling etc.; Need a good value proposition",,,"Mark Metrick
Janet S",,,
,444,Hudson's Bay,CPG,ThoughtWorks,3/1/2018,,Better use of the Store App to check-out,"Creating a new application or augmentation of the Store Application, with interface to help customer check-out with virtual receipt
Example- App interface with PLS systems, Price management system, Gift card processing'
Macy's just announced adopting this feature",,,x,,,
,445,Hudson's Bay,CPG,ThoughtWorks,3/1/2018,,Omni channel customer history view at call center/ for store associates,"For customer calls into call center – bring up the customer data during the call
Pull up the brands customer has bought before and other data on what customer prefers
Extend functionality to store Associates",,,x,,,
,446,Hudson's Bay,CPG,ThoughtWorks,3/1/2018,,Improve mobile app engagement,"Use mobile to draw customers in to the stores and engage better while at store; create applications that allow connection to style influencers by marketplace
No Mobile App for L&T/ Saks/ Off 5th;; Current HBC App  is  a mini version of the website, no push notifications",,,"Mark Metrick
Janet",,,
,447,Hudson's Bay,CPG,ThoughtWorks,3/1/2018,,Better marketing opportunity through channels/ loyalty prgrams,"Improvements in Marketing: Currently the only regular marketing tool used is email and the impact of these emails is extremely low
Target individual customers marketing based on lifestyle
Current loyalty program is a sign up form in store – need enhancements on this",,,x,,,
,448,Hudson's Bay,CPG,ThoughtWorks,3/1/2018,,Analytics to manage inventory/ store planning,"Product sell through based on available sizing by market and demographics is a big opportunity- better analytics are needed to become proactive in planning size capsules by store in order to turn inventory and increase margin
The ship from store process is helpful but not utilized often enough and is cost prohibitive in some remote markets",,,x,,,
,449,Hudson's Bay,CPG,ThoughtWorks,3/1/2018,,Improvement in current CRM system,"Current CRM system needs to be more customer behavior focused and focus on nurturing forward relationships – needs massive improvement
Stores are still using paper-books to keep track (similar in all the banners)",,,"Maria Mauramann
David Rollison, Divisional Project, HBC
John, VP Ops, HBC",,,
,450,Hudson's Bay,CPG,ThoughtWorks,3/1/2018,,Consistent reporting across systems,"Create consistent and accurate reporting across all systems- numbers vary from report to report today, especially for Saks and Off 5th",,,x,,,
,451,Hudson's Bay,CPG,ThoughtWorks,3/1/2018,,Improvement in PLs systems functionality,"PLS system functionality: System issues occasionally restrict the reference of previous purchases, restricting
the return process in stores- this includes GILT purchases
Opportunity especially in Saks and Off 5th",,,x,,,
,452,Hudson's Bay,CPG,ThoughtWorks,3/1/2018,,Shared Inventory functionality to capture data across banners,"Shared inventory capability - Currently when product moves between banners- ie. off price, it takes on a new SKU and all previous history is lost; leaving no way to explain any shortage later; especially in Off 5th banner",,,x,,,
,453,Hudson's Bay,CPG,ThoughtWorks,3/1/2018,,Technology for process improvement at the DC,"D.C. technology processes- goods are taking too long to get online once they hit the D.C
Combine with look at reasons for loss through the supply chain process",,,x,,,
,454,Hudson's Bay,CPG,ThoughtWorks,3/1/2018,,Tools to help margin planning,Create tools that would allow better margin planning of goods; Program/ item basis – to improve the buying process,,,x,,,
,455,"Relx group (Lexis Nexis, Elsevier) ",TMT,ThoughtWorks,3/1/2018,,Differentiate from competition using new age technologies,"Advisory services for use cases of machine learning to enhance their products and customer experience (eg using machine learning to pick news faster using social networking sites, prediction technology) ",,,xx,,,
,456,"Relx group (Lexis Nexis, Elsevier) ",TMT,ThoughtWorks,3/1/2018,,Expansion to bundled products,"Build analytics tools (including prototyping and POC) as a bundled service to existing products (i.e. replace Cognizant staff aug model). Example – legal analytics, research assistance, performance management",,,xx,,,
,457,"Relx group (Lexis Nexis, Elsevier) ",TMT,ThoughtWorks,3/1/2018,,Legacy moderniza-tion,Tolley transformation : implementation phase (LexisNexis wants this to be as quickly as possible),,,xx,,,
,458,"Relx group (Lexis Nexis, Elsevier) ",TMT,ThoughtWorks,3/1/2018,,Forward integration into value chain,Back end integration of merged/ acquired companies with LexisNexis IT backbone,,,xx,,,
,459,"Relx group (Lexis Nexis, Elsevier) ",TMT,ThoughtWorks,3/1/2018,,Differentiate from competition using new age technologies,"LexisAdvance application : continue to build enhancements, to data platform and mobile application using machine learning and natural language processing",,,xx,,,
,460,"Relx group (Lexis Nexis, Elsevier) ",TMT,ThoughtWorks,3/1/2018,,Legacy moderniza-tion,Cloud migration : Migrate products based on the Rosetta platform to cloud (check product migration of Mlex) ,,,xx,,,
,461,"Relx group (Lexis Nexis, Elsevier) ",TMT,ThoughtWorks,3/1/2018,,Legacy moderniza-tion,Agile transformation : using agile methodology to transform existing products (extension of transformations),,,xx,,,
,462,"Relx group (Lexis Nexis, Elsevier) ",TMT,ThoughtWorks,3/1/2018,,Targeted marketing for customers,"Using analytics on top of existing front end applications to analyze consumer preferences, cross sell, upsell products and share advanced recommendations",,,xx,,,
,463,"Relx group (Lexis Nexis, Elsevier) ",TMT,ThoughtWorks,3/1/2018,,Legacy moderniza-tion,Legacy modernization; migrate existing platforms to cloud,,,xx,,,
,464,"Relx group (Lexis Nexis, Elsevier) ",TMT,ThoughtWorks,3/1/2018,,New age offerings for healthcare industry,Providing platform layer or/and front end application layer to their solutions for the healthcare industry (eg –mobile application for myhealthtalent.com),,,xx,,,
,465,"Relx group (Lexis Nexis, Elsevier) ",TMT,ThoughtWorks,3/1/2018,,Increase customer stickiness,Building decision making tools based on analytics (eg personalised shared decision making to patients) for Elsevier to bundle with information services for its customers,,,xx,,,
,466,Southwest Airlines,TTL,ThoughtWorks,3/1/2018,,Enhancing customer experience,"Incorporating capabilities within customer applications such as –     Baggage tracking
Journey and way finding
Service disruption",,,x,,,
,467,Southwest Airlines,TTL,ThoughtWorks,3/1/2018,,Modernizing legacy data infrastructure,"Refactoring and updates to current applications to be based on cloud computing, reducing cycle time of apps; this will be based out of the new data centers",,,x,,,
,468,Southwest Airlines,TTL,ThoughtWorks,3/1/2018,,Operational systems for new flights,"Opportunity in pre implementation phase add Hawai– network operations center, flight planning tool, crew systems, in flight systems",,,x,,,
,469,Southwest Airlines,TTL,ThoughtWorks,3/1/2018,,Project management,"Advisory work on project management to encompass all the different investments/ initiatives (200-300) ongoing currently within IT and cross company, with analytics to gauge progress of projects – currently everything is being done manually",,,x,,,
,470,Southwest Airlines,TTL,ThoughtWorks,3/1/2018,,Automated communication to all relevant stakeholders,"Operational control center : a central management system to communicate between all relevant stakeholders : not only crew but also caterers, maintenance team for instance",,,x,,,
,471,Southwest Airlines,TTL,ThoughtWorks,3/1/2018,,Quick decision making/ strategy,"Collect all the airline data universe to evaluate the big picture and create strategies, test ideas using a tool ",,,x,,,
,472,Sysco Foods,CPG,ThoughtWorks,3/1/2018,,“One Sysco” approach,Back end integration ofIT systems of companies within Sysco being integrated together,,,,,,
,473,Sysco Foods,CPG,ThoughtWorks,3/1/2018,,Enhancing customer experience,"Developing more user friendly front end applications making it easier for customers to order, track, provide feedback, deal with credits and returns",,,,,,
,474,Sysco Foods,CPG,ThoughtWorks,3/1/2018,,Making systems more efficient and agile,"Modernization of legacy back end systems – migrating them to cloud, making them agile ",,,,,,
,475,Sysco Foods,CPG,ThoughtWorks,3/1/2018,,Having seamless back end systems,"Addition of modules to their ERP “SUS” which Sysco has built inhouse (e.g., addition of real time visibility of inventory in warehouses)",,,,,,
,476,Sysco Foods,CPG,ThoughtWorks,3/1/2018,,Tracking accountability and performance within organisation,Creating performance management systems that are driven by key metrics and can enable measurement of impact by employees,,,,,,
,477,Sysco Foods,CPG,ThoughtWorks,3/1/2018,,Create more stickiness for customers,Consultation/development of value added services for restaurants (Sysco’s main customers) such as prediction of orders and supplies needed using historical data and social media analytics ,,,,,,
,478,Sysco Foods,CPG,ThoughtWorks,3/1/2018,,Creating more stickiness for customers,"Creating platforms for focused/individualized marketing: using data analytics to leverage order history of customers, SOW of Sysco to up sell, cross sell specific products to customers",,,,,,
,479,Sysco Foods,CPG,ThoughtWorks,3/1/2018,,Reducing supply chain costs,"Supply chain optimization:
Designing route optimization programs for trucks operated by Sysco for food distribution
Integration of electric trucks (newer technology being used by Sysco) to the existing supply chain systems",,,,,,
,480,Sysco Foods,CPG,ThoughtWorks,3/1/2018,,Increasing supply chain visibility,"Supply chain real time visibility: creating systems that can help track shipments in transit in real time, coordinate with drivers, build a pro active alert system in case of deviations",,,,,,
,481,Sysco Foods,CPG,ThoughtWorks,3/1/2018,,Enhance supplier experience,"Creating supplier facing tools to provide suppliers with easy to use interfaces to track orders, debits and interact with Sysco digitally",,,,,,
,482,Sysco Foods,CPG,ThoughtWorks,3/1/2018,,Reducing procurement and category management costs,Category Management: using analytics to leverage size and scale to reduce costs by rationalizing vast number of product lines and/or reducingprocurement costs,,,,,,
,483,Sysco Foods,CPG,ThoughtWorks,3/1/2018,,Increasing revenues from key customers,Business review enhancements for Sysco: creating tools for Sysco to conduct their business review meetings with key customers driven by leveraging data analytics,,,,,,
,484,Telus international,TMT,ThoughtWorks,3/1/2018,,Improving customer experience,"Telus Digital: Introduction of AI/NLP powered virtual assistants for care agents and for customer interaction
Unification of pivot chair systems, grown through acquisitions ",,,,,,
,485,Telus international,TMT,ThoughtWorks,3/1/2018,,Movement towards high speed networks,Telus Digital: Long term initiative for Falcon community launches,,,,,,
,486,Telus international,TMT,ThoughtWorks,3/1/2018,,Digitizing every step of customer journey,"Telus Digital: Building platforms for digital on-boarding of customers
Introducing virtual chatbots",,,,,,
,487,Telus international,TMT,ThoughtWorks,3/1/2018,,Introducing new services every year to increase customer base,"Telus Digital: - Possible redesign of Digital Wireline real estate: Home Solutions etc
Launch of the Family Share plan, and corresponding feature sets",,,,,,
,488,Telus international,TMT,ThoughtWorks,3/1/2018,,Getting real time insights into business perfor-mance,"Managing Big Data Lakes & Gleaming Insights: Using Hadoop infrastructure to create big data lakes and getting real time alerts and analytics to counter network outages, sub optimal performance, degraded QoS, improve churn, loyalty and retention, monetise anonymised data sets etc.",,,,,,
,489,Telus international,TMT,ThoughtWorks,3/1/2018,,Improving self-service to reduce personnel costs,"Koodo – introduction of chatbots, AR/VR, integration with Google Home and launch mobile applications to improve self-service",,,,,,
,490,Telus international,TMT,ThoughtWorks,3/1/2018,,Maintain continuity of systems,Koodo- Bringing in a new system of online charging and rating engine swap most likely given demise of RedKnee,,,,,,
,491,Telus international,TMT,ThoughtWorks,3/1/2018,,Moving towards new age networks,"Tech Strategy: Working on cutting edge technology stacks for eSIM deployment, SDN, NFV, SON, Identity, creating dashboards and reporting on network performance etc.",,,,,,
,492,Telus international,TMT,ThoughtWorks,3/1/2018,,Continuous update of legacy systems ,"Telus BTO: Developing billing, Robotic Process Automation, order Management, Catalogue Manage-ment & Pricing; currently being done by Netcracker, Amdocs, Ericsson & Genesys with a budget of over 40 M USD",,,,,,
,493,Telus international,TMT,ThoughtWorks,3/1/2018,Health,Modernize legacy platforms to enable easy integration,"Building next generation pharmacy platform to utilize cloud APIs, build and easily integrate mobile applications",,,"Sanjay Cherian, Brian Devereaux and Luc Gagnon",,,
,494,Telus international,TMT,ThoughtWorks,3/1/2018,Health,Get insights on healthcare customers for more targeted selling,Using big data analytics to create patient dashboards and get insights to offer a more customized product to the patient,,,Michael Guerriere and Ali Mir,,,
,495,Telus international,TMT,ThoughtWorks,3/1/2018,Health,Launching new age healthcare products to increase penetration in market,"Building a health platform for proactive lifestyle management, with prescriptive and predictive analytics",,,xx,,,
,496,Telus international,TMT,ThoughtWorks,3/1/2018,,Develop managed IT services offering,"Developing public and private cloud, and professional service capabilities",,,,,,
,497,Telus international,TMT,ThoughtWorks,3/1/2018,,"Upgrading BSS, OSS systems","Automating and upgrading revenue management software, including test automation and process automation; Amdocs is the legacy vendor currently but Telus open to another vendor who can bring in required capabilities",,,,,,
,498,Telus international,TMT,ThoughtWorks,3/1/2018,,Internal integration of identity,"Integrating all identity platforms to a single platform for access to internal systems using the same identity, and then migrating to Ping Federation platform",,,,,,
,499,Tesco,CPG,ThoughtWorks,3/1/2018,,Accelerate platform build out,"Accelerate the build out of the platform of API microservices
Only 30% is through right now and top of mind
Tesco wants to build new applications",,,"Jayesh
Andy",,,
,500,Tesco,CPG,ThoughtWorks,3/1/2018,,Replenishement systems,Tesco is creating new replenishment systems – millions being spent on that,,,Mike Yorwath,,,
,501,Tesco,CPG,ThoughtWorks,3/1/2018,,Unique value proposition (strategic),"Tesco has a problem in hiring/ retaining engineers; Providers can help on this through the right value proposition – 'we will give you scrum teams for end to end proposition' etc. Along with, pitch help:
New Calling App that is being built, labour scheduling platform, Clubcard initiatives",,,xxx,,,
,502,Tesco,CPG,ThoughtWorks,3/1/2018,,Analytics platform built,"Little data available in an accessible form – need to create a 'data lake' 
Accelerate capabilities with analytics / machine learning capability on top of that",,,xxx,,,
,503,Tesco,CPG,ThoughtWorks,3/1/2018,,Alliance with Dunhumby on their agenda,Engage with DunnHumby on accelerating their shift to a Product Management approach,,,Shailja Patel,,,
,504,Tesco,CPG,ThoughtWorks,3/1/2018,,Capability building/ advisory,"Help Tesco accelerate capability building – tackling legacy system constraint, through product management perspective on systems architecture",,,Richard Copperwaithe,,,
,505,Tesco,CPG,ThoughtWorks,3/1/2018,,Management of Infra-structure,"More efficient Infrastructure management: particularly around colleagues' workspace, so that staff have proper access to ""2018 tools"" rather than struggling to upgrade from older versions",,,xxx,,,
,506,Tesco,CPG,ThoughtWorks,3/1/2018,,Booker acquisition,Offer to help on assessing systems opportunities arising from the acquisition of Booker,,,xxx,,,
,507,Tesco,CPG,ThoughtWorks,3/1/2018,,Master data Management,"Master data management
Tesco has number of different data warehouses technologies; and multiple versions
Enormous scope for discovery/ proliferation of data (for single view of the data)",,,xxx,,,
,508,Tesco,CPG,ThoughtWorks,3/1/2018,,Presentation of the data,"Tesco moving to a service oriented architecture
Legacy applications / buying systems/ forecasting: Attempting to provide records around enterprise systems for a microservice type approaches; looking at agile delivery model, for repeatable API patterns to segregate the APIs",,,xxx,,,
,509,Tesco,CPG,ThoughtWorks,3/1/2018,,Store back-office App tree,"Cross business decisions: UK markets have stringent price competitions; Tesco is stripping out entire management layer, and concentrated decision making into small group of people in store
Back office functionality is no longer fit for the purpose; So that needs customization to the group size, esp. reporting/ data visualization in store to help the store staff",,,"Sally Marriott, Retail Technology",,,
,510,Tesco,CPG,ThoughtWorks,3/1/2018,,Enhancements to in-store pick applications,"In-store pick' applications (fulfilment application behind the online website); There are large scale customer cancellations, app unable to capture nuances
Need distributed apps to extend the OMS",,,x,,,
,511,Tesco,CPG,ThoughtWorks,3/1/2018,,Supply chain analytics for GM/ Fashion products,"Supply chain data is customized to the grocery side; vs general merchandising/ fashion
GM/ Fashion have seasonal products that need different forecasting capabilities, need a solution that can help
E.g. Making better use of data available for RFID implementation (largest scale roll outs of RFID in last 18 months that has given granular data at the store)
Distribution from store to store than DCs (Tesco can exprimement that)",,,xxx,,,
,512,Tesco,CPG,ThoughtWorks,3/1/2018,,Guided shopping/ Predictive analytics,"Application to ease and automate the app of goods to baskets
E.g. IFTTT (set on a trading website – if a price reaches a certain point, then a certain action)",,,xxx,,,
